Title,Schedule,Description,Location,Phone,Email,Website
Children in Care,N/A,"Leaving Care - Advice and support for when you leave care. Council’s responsibilities - As a corporate parent for children in care we have certain responsibilities. Residential homes - Accommodation for young people that have emotional, attachment or behaviour difficulties. Independent reviews - Reviewing the needs…",WN3 4NW,N/A,N/A,N/A
Children in Care Activity Groups,N/A,"If you're in care and aged 7-12 (Junior) or 13-19 (Senior) you're welcome to come along to one of these groups in your local area. Junior groups offer activities such as archery, arts and crafts, cookery and games. The senior group gives you the chance to influence…",01942 487100,N/A,N/A,N/A
EDIT (Early Detection and Intervention Team),N/A,Early Detection and Intervention Team (EDIT) is a specialist psychological therapy service that works with young people aged 14 – 35 years who are experiencing distress and symptoms such as: Hearing or seeing things that others cannot Feeling paranoid or suspicious of people or certain…,"Sale Way, LEIGH, WN7 4JY",N/A,N/A,N/A
Wigan and Leigh Carers Centre (WLCC),Open Monday to Friday from 9 am until 4.30 pm,Carers are at the heart of everything we do.  We care deeply about making it our mission to make a positive difference to the lives of both young and adult carers in the Wigan and Leigh Borough.   Are you an unpaid / unwaged Carer?…,"3-5, Frederick Street, Hindley, Wigan, Greater Manchester, WN2 3BD, 01942 697885",N/A,N/A,N/A
Wigan and Leigh College,N/A,"We have been providing quality education and training for the people of Wigan and beyond since 1857. We offer exceptional teaching, support and guidance in a range of academic, vocational, technical and apprenticeship programmes. We offer significant progression routes alongside key employability skills, preparing you…","Parson's Walk, Wigan, WN1 1RS, 01942 761 600",N/A,N/A,N/A
Wigan and Leigh Young Carers,N/A,"Young carers and their families do not always know where to go for help. You may not have realised that your child is a young carer, as it’s just part of your family life, or you may have hit a crisis point and don’t know…",01942 697885,N/A,N/A,N/A
