Title,Schedule,Description,Location,Phone,Email,Website
Citizens Advice Wigan Borough (Leigh office),Monday - Thursday 10am - 1pm,"Citizens Advice Wigan Borough provides free, independent, confidential,  impartial advice and information.  We can help with money problems, court forms, benefits, work, family matters and housing.   You can access our services in person, by telephone or via email, full details of how to contact us…","Suite 2.1 Magnum House, 33 Lord Street, Leigh, WN7 1BY",N/A,N/A,N/A
Citizens Advice Wigan Borough (Wigan office),Monday - Thursday 10am - 1pm,"Citizens Advice Wigan Borough provides free, independent, confidential,  impartial advice and information.  We can help with money problems, court forms, benefits, work, family matters and housing.   You can access our services in person, by telephone or via email, full details of how to contact us…","Wigan Life Centre North, The Wiend, Wigan, Wigan, LANCASHIRE, WN1 1NH",N/A,N/A,N/A
Family Rights Group,N/A,"Family Rights Group promotes policies and practices that keep children safe within their family and strengthen the family and community networks of those children who cannot live at home. We campaign for families to have their voice heard, be treated fairly and get help early to…",N/A,N/A,N/A,N/A
Gingerbread,N/A,"We want a society in which single parent families are treated equally and fairly. To get there, we provide information to help single parents support themselves and their family. We run programmes to equip single parents with the skills and opportunities to gain employment. And…",N/A,N/A,N/A,N/A
Legal Aid Agency,N/A,"We have a team of around 1,250 staff and offices in towns and cities across England and Wales. Our head office is in London. We are responsible for: making sure legal aid services from solicitors, barristers and the not-for-profit sector are available to the general…",N/A,N/A,N/A,N/A
Victim Support,N/A,"As an independent charity, we work towards a world where people affected by crime or traumatic events get the support they need and the respect they deserve. We help people feel safer and find the strength to move beyond crime. Our support is free,…",WN1 1NH,N/A,N/A,N/A
